{"candidateFingerprint":"315bc72ff17630ccab617272585bba9815aab1735a201d595341da56794f5ccc","candidateId":"SHADOW_LADDER_v0","checks":{"groups":["determinism 3","operators 2","span/ME 4","court 3","A1 2","A2 3","seam 3","termination 4","incidence 3","guards 3","achirality 1","bindings 2"],"total":33},"courtAlignment":{"courtWindows":{"count":5,"form":"C_j=[-j,4-j]","verified":"5/5","windowSize":5},"modeWindows":{"count":7,"form":"mode(k)=[-k,6-k]","verified":"7/7","windowSize":7},"windowIntersection":{"theorem":"window(j) intersection window(j+d)=7-d; d=2 gives Court 5-35","verified":"5/5"}},"evidenceBindings":{"auditFingerprint":"ddadee9cb67c46b937c0bd542ceeff3b8a171f63c7e19d6fadb645aeced80453","canonicalLedgerSha256":"e6570972260fdae5c4ca878272dc89a9ff353d48762eefbe019707d229cd242d","constructionEdgesFingerprint":"21e2a632837ecf40fe9229e9eb4ec0a5cceb9e2043fe89cb8e1d320518d7bdbc","courtRootedPositionsSha256":"85100e4bb5185b2630d1607a35e417fc90fdd5bb4ae63f0e775224d6b1436fec","decisionLedgerSha256":"45653693ea4b5471412ad60e518ffd8333e3d87091ff007a7b5c9eee026d8139","networkFingerprint":"21e2a632837ecf40fe9229e9eb4ec0a5cceb9e2043fe89cb8e1d320518d7bdbc","observationLedgerSha256":"8e0be9f5bcee0af1aeb87b8ee71fa18121376c1e2b8e23416439c8834e17787f"},"method":{"Tn":"12-bit pitch-class rotation","comp":"4095 ^ mask","fifthOrder":[0,7,2,9,4,11,6,1,8,3,10,5],"fifthSpan":"minimal covering arc =12-largest cyclic gap","holes":"span+1-cardinality"},"schemaVersion":"fivefold-incubator.shadow-ladder.v0","scope":{"A3":"termination proven, no A3","diatonicSetClass":"7-35","shadowTiers":["A1","A2"],"tuning":"12-TET"},"shadowLadder":[{"coreMask":661,"fifthArc":"[0,4]","fifthPositions":[0,1,2,3,4],"fifthSpan":4,"holes":0,"office":"Moon","tier":"A1"},{"coreMask":677,"fifthArc":"[11,3]","fifthPositions":[11,0,1,2,3],"fifthSpan":4,"holes":0,"office":"Mars","tier":"A1"},{"coreMask":1189,"fifthArc":"[10,2]","fifthPositions":[10,11,0,1,2],"fifthSpan":4,"holes":0,"office":"Mercury","tier":"A1"},{"coreMask":1193,"fifthArc":"[9,1]","fifthPositions":[9,10,11,0,1],"fifthSpan":4,"holes":0,"office":"Jupiter","tier":"A1"},{"coreMask":1321,"fifthArc":"[8,0]","fifthPositions":[8,9,10,11,0],"fifthSpan":4,"holes":0,"office":"Venus","tier":"A1"},{"coreMask":597,"fifthArc":"[0,6]","fifthSpan":6,"holes":2,"office":"Sun","parentArcs":["[0,8]","[10,6]"],"punched":[1,5],"tier":"A2"},{"coreMask":1173,"fifthArc":"[10,4]","fifthSpan":6,"holes":2,"office":"Mars","parentArcs":["[10,6]","[8,4]"],"punched":[11,3],"tier":"A2"},{"coreMask":681,"fifthArc":"[9,3]","fifthSpan":6,"holes":2,"office":"Mercury","parentArcs":["[9,5]","[7,3]"],"punched":[10,2],"tier":"A2"},{"coreMask":1317,"fifthArc":"[8,2]","fifthSpan":6,"holes":2,"office":"Jupiter","parentArcs":["[8,4]","[6,2]"],"punched":[9,1],"tier":"A2"},{"coreMask":1353,"fifthArc":"[6,0]","fifthSpan":6,"holes":2,"office":"Saturn","parentArcs":["[6,2]","[4,0]"],"punched":[7,11],"tier":"A2"}],"shadowRingGeometry":{"dHCensus":{"pairs":"5xdH2, 2xdH10, 0xdH4","verified":"7/7"},"hexachord":{"T1_swaps":true,"WT":"{0,2,4,6,8,10}","neapolitan":"odd+{0}","odd":"{1,3,5,7,9,11}","verified":"5/5"},"holePunching":{"description":"core(k,A2)=parent arcs intersection minus their inside holes","verified":"5/5"},"seamTwins":{"march":"{0,6}->{1,5}->{2,4}","perTier":2,"verified":"4/4"},"spanME":{"fifthSpan4":"5-35","fifthSpan6":"5-34","fifthSpan8":"5-33","holes":"span+1-5","verified":"source-derived"}},"status":"planning_evidence","typedIncidences":{"coreConstructionPair":{"count":10,"note":"core is the intersection of two source-selected parents","verified":"10/10 interior"},"coreSelfOfficeDiatonic":{"count":5,"note":"A2 core is a subset of the same-office A0 anchor","verified":"5/5 interior"},"embeddingCensus":{"outOfCensus":"10 edges (A2 to A1) outside 252","span4":"15/36","span6":"5/120"},"note":"Pentatonic parent counts are read from the detached audit; no topology is written."}}